adult,backdrop_path,genre_ids,id,original_language,original_title,overview,popularity,poster_path,release_date,title,video,vote_average,vote_count,runtime,budget,revenue,production_company_id,year,minhas_notas
False,/sNyXUHwKl1Grg3daPHJZmA2kbdJ.jpg,[27],21484,5,Possession,"A young woman left her family for an unspecified reason. The husband determines to find out the truth and starts following his wife. At first, he suspects that a man is involved. But gradually, he finds out more and more strange behaviors and bizarre incidents that indicate something more than a possessed love affair.",29.411,/k2nVjEnMF0ZVE0V8x5WZQw231FF.jpg,1981-05-27,Possession,False,7.4,1137,124,2400000,1200000,9.0,1981.0,4.5
False,/zZvtZZXRnZ4Tdcs0QEWaZZcIWy8.jpg,"[53, 9648]",567,2,Rear Window,A wheelchair-bound photographer spies on his neighbors from his apartment window and becomes convinced one of them has committed murder.,28.25,/ILVF0eJxHMddjxeQhswFtpMtqx.jpg,1954-08-01,Rear Window,False,8.3,6602,112,1000000,37042336,4.0,1954.0,4.5
False,/77aHwg1SCy89rfvQtiruPU58qEV.jpg,"[9648, 10749, 53]",426,2,Vertigo,"A retired San Francisco detective suffering from acrophobia investigates the strange activities of an old friend's wife, all the while becoming dangerously obsessed with her.",30.252,/15uOEfqBNTVtDUT7hGBVCka0rZz.jpg,1958-05-28,Vertigo,False,8.2,5822,128,2479000,7808900,4.0,1958.0,4.0
False,/yuGyks7DE9NrRfguRWYomN4KNcm.jpg,"[27, 9648, 53]",44040,2,Devil,"A group of people are trapped in an elevator high above Philadelphia, and one of them is the devil.",16.796,/aivXPSi53H95BoUa5njEYso389s.jpg,2010-09-16,Devil,False,6.1,2899,80,10000000,33583175,33.0,2010.0,0.5
False,,[35],499901,2,Audition,"A character study about a childlike man who believes in signs, but gets himself in trouble when he arrives in the big city to audition for a movie.",0.992,/nINUr5FANZ6DHv0SQ8rbUEO7g1T.jpg,2007-04-19,Audition,False,0.0,0,20,0,0,,1999.0,4.0
False,/gF1BbDac7ONryE5jezRzXVe31Ud.jpg,"[27, 9648, 53]",3600,2,I Still Know What You Did Last Summer,"Ever since killing the Fisherman one year ago, Julie James is still haunted by images of him after her. When her best friend Karla wins free tickets to the Bahamas, Julie finds this a perfect opportunity to finally relax. But someone is waiting for her. Someone who she thought was dead. Someone who is out again for revenge.",17.026,/motBJIO921LFZkoGKCSbmSCVHBc.jpg,1998-11-13,I Still Know What You Did Last Summer,False,5.356,1506,100,65000000,40002112,1464.0,,
False,/g23E3sxMuzPWXQ8uVZi1rkY15jU.jpg,"[27, 53]",7340,2,Carrie,"Withdrawn and sensitive teen Carrie White faces taunting from classmates at school and abuse from her fanatically pious mother. When strange occurrences start happening around Carrie, she begins to suspect that she has supernatural powers.",33.797,/bJJ3xK4pMnfao0wfzySfC47dp8G.jpg,1976-11-03,Carrie,False,7.3,3917,98,1800000,33800000,60.0,1976.0,4.0
False,/xpTHHojJnJQgavgMw5OQYUzuNIU.jpg,"[27, 9648]",2667,2,The Blair Witch Project,"In October of 1994 three student filmmakers disappeared in the woods near Burkittsville, Maryland, while shooting a documentary. A year later their footage was found.",33.508,/9050VGrYjYrEjpOvDZVAngLbg1f.jpg,1999-07-14,The Blair Witch Project,False,6.347,4946,81,60000,248639099,15160.0,1999.0,3.0
False,/uif5fUshJrXyyDzfpzp1DLw3N0S.jpg,"[27, 53, 9648]",539,2,Psycho,"When larcenous real estate clerk Marion Crane goes on the lam with a wad of cash and hopes of starting a new life, she ends up at the notorious Bates Motel, where manager Norman Bates cares for his housebound mother.",45.38,/yz4QVqPx3h1hD1DfqqQkCq3rmxW.jpg,1960-06-22,Psycho,False,8.424,10234,109,806947,32000000,10717.0,1960.0,4.5
False,/mHG7dpLb0ZScSY3LpP443IHRmjy.jpg,"[16, 53]",10494,12,PERFECT BLUE,"Encouraged by her managers, rising pop star Mima takes on a recurring role on a popular TV show, when suddenly her handlers and collaborators begin turning up murdered.",39.364,/bee6ZQVaSAUhlBinsP9In8x8vO1.jpg,1998-02-28,Perfect Blue,False,8.3,2738,85,830000,112536,3464.0,1997.0,4.0
False,/eDLp4uFdqP1gpy9oMrutwH6Q64I.jpg,"[18, 53, 27]",44214,2,Black Swan,"The story of Nina, a ballerina in a New York City ballet company whose life, like all those in her profession, is completely consumed with dance. She lives with her retired ballerina mother Erica who zealously supports her daughter's professional ambition. When artistic director Thomas Leroy decides to replace prima ballerina Beth MacIntyre for the opening production of their new season, Swan Lake, Nina is his first choice.",45.9,/viWheBd44bouiLCHgNMvahLThqx.jpg,2010-12-03,Black Swan,False,7.686,14651,109,13000000,329398046,43.0,2010.0,3.5
False,/wHXe0ahrRHRphjYbkRLlj9W8cFj.jpg,"[18, 27]",96001,16,Trabalhar Cansa,"After her husband loses his job, Helena opens her own grocery store. Soon, increasingly strange events begin to plague her store, making her question her sanity.",2.433,/69OvvOWlPs6PR3NP3dueiCnyOoE.jpg,2011-09-30,Hard Labor,False,6.4,38,99,0,0,47462.0,2011.0,4.0
False,/xFUk2PlZY2gyCmQla7HcbEzvn4Y.jpg,"[27, 9648, 53]",10885,2,Shutter,"A newly married couple discovers disturbing, ghostly images in photographs they develop after a tragic accident. Fearing the manifestations may be connected, they investigate and learn that some mysteries are better left unsolved.",16.833,/bft6OyITsxSZuTxu2oJipApLran.jpg,2008-03-21,Shutter,False,5.6,740,90,0,0,508.0,2004.0,3.0
False,/n53tZyZQZdLPfcxupO51efKMaAc.jpg,[27],30497,2,The Texas Chain Saw Massacre,"Five friends head out to rural Texas to visit the grave of a grandfather. On the way they stumble across what appears to be a deserted house, only to discover something sinister within. Something armed with a chainsaw.",37.242,/aLG1o8vJRzXR8Z0zlHnVKifg2Ra.jpg,1974-10-11,The Texas Chain Saw Massacre,False,7.283,3394,83,140000,30900000,1197.0,1974.0,3.0
False,/aRka9neADW1M0Zf9lF8kW2jEgXe.jpg,"[27, 53]",948,2,Halloween,"Fifteen years after murdering his sister on Halloween Night 1963, Michael Myers escapes from a mental hospital and returns to the small town of Haddonfield, Illinois to kill again.",43.312,/wijlZ3HaYMvlDTPqJoTCWKFkCPU.jpg,1978-10-24,Halloween,False,7.6,5705,91,325000,70260597,14323.0,1978.0,3.0
False,/gGgDMV1vN20q8qEdxV0K43UrK0y.jpg,"[27, 9648, 53]",507089,2,Five Nights at Freddy's,"Recently fired and desperate for work, a troubled young man named Mike agrees to take a position as a night security guard at an abandoned theme restaurant: Freddy Fazbear's Pizzeria. But he soon discovers that nothing at Freddy's is what it seems.",99.614,/4dKRTUylqwXQ4VJz0BS84fqW2wa.jpg,2023-10-25,Five Nights at Freddy's,False,7.489,4245,110,20000000,297144130,3172.0,2023.0,0.5
False,/ruF3Lmd4A8MHbnEBE6lxPMbsHGL.jpg,"[9648, 18]",15,2,Citizen Kane,"Newspaper magnate Charles Foster Kane is taken from his mother as a boy and made the ward of a rich industrialist. As a result, every well-meaning, tyrannical or self-destructive move he makes for the rest of his life appears in some way to be a reaction to that deeply wounding event.",29.983,/sav0jxhqiH0bPr2vZFU0Kjt2nZL.jpg,1941-04-17,Citizen Kane,False,7.998,5604,119,839727,23218000,11447.0,1941.0,3.5
False,/joOlYI5hPsc7txTRFSR8e1wNniV.jpg,"[12, 35, 18]",421,2,The Life Aquatic with Steve Zissou,"Renowned oceanographer Steve Zissou has sworn vengeance upon the rare shark that devoured a member of his crew. In addition to his regular team, he is joined on his boat by Ned, a man who believes Zissou to be his father, and Jane, a journalist pregnant by a married man. They travel the sea, all too often running into pirates and, perhaps more traumatically, various figures from Zissou's past, including his estranged wife, Eleanor.",17.067,/qZoFLNBC78jzboWeDH6Ha0qavF2.jpg,2004-12-10,The Life Aquatic with Steve Zissou,False,7.1,2913,119,50000000,34808403,23449.0,2004.0,3.0
False,/gt4EnUGbbGbNOX0q47YII3WxB48.jpg,"[878, 18]",13363,2,The Man from Earth,"An impromptu goodbye party for Professor John Oldman becomes a mysterious interrogation after the retiring scholar reveals to his colleagues he never ages and has walked the earth for 14,000 years.",24.722,/x795RrV92JbLXh4pBSEEe62Nmv0.jpg,2007-06-10,The Man from Earth,False,7.624,2559,87,200000,0,2741.0,2007.0,0.5
False,/2J283YNxKhxAqHeVegUJ5mzLfGb.jpg,"[9648, 18, 80]",392044,2,Murder on the Orient Express,Genius Belgian detective Hercule Poirot investigates the murder of an American tycoon aboard the Orient Express train.,39.301,/7GtdJU6iAg6fjQu3E3zta3bIAQh.jpg,2017-11-03,Murder on the Orient Express,False,6.704,10027,114,55000000,352800000,1557.0,2017.0,1.0
False,/keEWjA5ykLJo851tIBFdmkxPxxh.jpg,"[27, 9648]",270303,2,It Follows,"When carefree teenager Jay sleeps with her older boyfriend for the first time, she learns that she is the latest recipient of a fatal curse that is passed from victim to victim via sexual intercourse. Death, Jay learns, will creep inexorably toward her as either a friend or a stranger. Jay's friends don't believe her seemingly paranoid ravings, until they too begin to see the phantom assassins and band together to help her defend herself.",45.162,/iwnQ1JH1wdWrGYkgWySptJ5284A.jpg,2015-02-04,It Follows,False,6.581,6452,101,2300000,23374076,52739.0,2014.0,2.0
False,/iXq6SRu8YK0Bo5jFpfQ8TYCNaet.jpg,[18],55700,16,Ossos,"After a suicidal teenage girl gives birth, she misguidedly entrusts her baby’s safety to the troubled, deadbeat father, whose violent actions take the viewer on a tour of the foreboding, crumbling shantytown in which they live.",2.321,/tWc83zOjnZ4S6XrTFTHeI0LuHo3.jpg,1997-11-14,Ossos,False,6.8,42,97,0,0,11143.0,1997.0,2.0
False,/nb3xI8XI3w4pMVZ38VijbsyBqP4.jpg,"[18, 36]",872585,2,Oppenheimer,The story of J. Robert Oppenheimer's role in the development of the atomic bomb during World War II.,140.755,/8Gxv8gSFCU0XGDykEGv7zR1n2ua.jpg,2023-07-19,Oppenheimer,False,8.1,9881,181,100000000,952000000,9996.0,2023.0,3.0
False,/gkyYZSevVI6zbGrLDmSo9Im88Qv.jpg,"[35, 18]",10322,2,Being There,"A simple-minded gardener named Chance has spent all his life in the Washington D.C. house of an old man. When the man dies, Chance is put out on the street with no knowledge of the world except what he has learned from television.",11.559,/3RO3jbCKEey2T9bYFkYt9xpwen9.jpg,1979-12-19,Being There,False,7.616,1002,130,0,30177511,60.0,1979.0,1.0
False,/xqifM3qMTLZ91knsftAYxq55xwc.jpg,"[878, 18, 53, 27]",20620,2,Seconds,An unhappy middle-aged banker agrees to a procedure that will fake his death and give him a completely new look and identity; one that comes with its own price.,10.915,/5G3q3OvulFTnFdiouaZdD8wjtIc.jpg,1966-10-05,Seconds,False,7.3,367,108,2500000,1750000,3809.0,1966.0,2.5
False,/76phbJ3Brq4VmpOomEOW9bNy8C5.jpg,[18],42113,12,楢山節考,In a small village in a valley everyone who reaches the age of 70 must leave the village and go to a certain mountain top to die. If anyone should refuse they would disgrace their family. Old Orin is 69. This winter it is her turn to go to the mountain. But first she must make sure that her eldest son Tatsuhei finds a wife.,9.844,/ewYZmeoqzE5XsL0Jlcorlu9iwGe.jpg,1983-04-29,The Ballad of Narayama,False,7.5,171,130,0,0,5822.0,1958.0,3.0
False,/tIlhG6ZmJFF1NKEA3aMWJhXhW78.jpg,"[18, 878, 10752]",24559,2,Slaughterhouse-Five,"Billy Pilgrim, a veteran of the Second World War, finds himself mysteriously detached from time, so that he is able to travel, without being able to help it, from the days of his childhood to those of his peculiar life on a distant planet called Tralfamadore, passing through his bitter experience as a prisoner of war in the German city of Dresden, over which looms the inevitable shadow of an unspeakable tragedy.",9.106,/gM2q9pGW9x2zdEMPRsXLBgTDDFH.jpg,1972-03-15,Slaughterhouse-Five,False,6.5,227,100,3200000,0,33.0,1972.0,2.0
False,/avjG5EPgWXyLvsUId6hEn0iqT4A.jpg,"[18, 878, 9648]",2103,2,Solaris,A troubled psychologist is sent to investigate the crew of an isolated research station orbiting a bizarre planet.,17.38,/drdrB1hEZmzFlK1xtW5HMxK3LUJ.jpg,2002-11-27,Solaris,False,5.918,1321,99,47000000,30002758,25.0,1972.0,4.5
False,/pIUFQCm8Lw5eU0heWXqxO4vKm2Z.jpg,[18],106380,24,青梅竹馬,"A young woman urgently seeks to navigate the maze of contemporary Taipei and find a future. She hopes that her boyfriend Lung is the key to the future, but Lung is stuck in a past that combines baseball and traditional loyalty that leads him to squander his nest egg bailing her father out of financial trouble.",9.586,/veJ93QUnTBX4WXk5qSl1s42Uosj.jpg,1985-05-01,Taipei Story,False,7.461,114,120,0,0,152025.0,1985.0,3.5
False,/okdg55jhsr9k1F2lxsZoQncrLZL.jpg,"[18, 10749, 10752, 36]",3175,2,Barry Lyndon,"An Irish rogue uses his cunning and wit to work his way up the social classes of 18th century England, transforming himself from the humble Redmond Barry into the noble Barry Lyndon.",19.787,/dOJtBSyI30wWc08UmyEKLsu4Rfk.jpg,1975-12-18,Barry Lyndon,False,8.0,2873,185,11000000,260131,174.0,1975.0,2.5
False,/1nDkLdNGqWJiyEFOzubRHs5IUd4.jpg,"[18, 10402, 35]",3121,2,Nashville,"The intersecting stories of twenty-four characters—from country star to wannabe to reporter to waitress—connect to the music business in Nashville, Tennessee.",10.946,/twl4ovyjb8muFKvZmcCDzPR0hy1.jpg,1975-06-11,Nashville,False,7.2,407,160,2200000,9991258,4.0,1975.0,4.5
False,/5Pl47mB0Jnrg4oHoO0sVdJ6WMRL.jpg,[18],405,11,La strada,"When Gelsomina, a naïve young woman, is purchased from her impoverished mother by brutish circus strongman Zampanò to be his wife and partner, she loyally endures her husband's coldness and abuse as they travel the Italian countryside performing together. Soon Zampanò must deal with his jealousy and conflicted feelings about Gelsomina when she finds a kindred spirit in Il Matto, the carefree circus fool, and contemplates leaving Zampanò.",8.196,/rwjbT0zlsUDMztaCcWjlWuxaEL1.jpg,1954-09-23,La Strada,False,7.9,1077,108,0,0,217.0,1954.0,3.0
False,/qnaQVbMiUuTezPIuXfcdlTeFU9d.jpg,[18],174958,1,Harakiri,"The daughter of a Daimyo, one forced to commit harakiri to secure her a future to choose her own destiny, falls in love with and marries a European officer. The officer returns to Europe but promises to come back for her and his new child, but when he comes back to Japan, he brings his European wife.",2.49,/xDXMUdERs3uFtgO8P5J5WyWT554.jpg,1919-12-18,Harakiri,False,5.8,20,87,0,0,6762.0,1962.0,4.5
False,/stiGp1XzkLSYdUUEWTyQOZRkr49.jpg,[18],3782,12,生きる,"Kanji Watanabe is a middle-aged man who has worked in the same monotonous bureaucratic position for decades. Learning he has cancer, he starts to look for the meaning of his life.",15.415,/dgNTS4EQDDVfkzJI5msKuHu2Ei3.jpg,1952-10-09,Ikiru,False,8.3,1175,143,0,55240,882.0,1952.0,3.5
False,/cy7ymUaMEWRoig7LWXpfzaaw2vv.jpg,[18],147,5,Les Quatre Cents Coups,"For young Parisian boy Antoine Doinel, life is one difficult situation after another. Surrounded by inconsiderate adults, including his neglectful parents, Antoine spends his days with his best friend, Rene, trying to plan for a better life. When one of their schemes goes awry, Antoine ends up in trouble with the law, leading to even more conflicts with unsympathetic authority figures.",16.813,/12PuU23kkDLvTd0nb8hMlE3oShB.jpg,1959-06-03,The 400 Blows,False,8.03,2168,99,0,0,53.0,1959.0,2.0
False,/xzfR4D9G1YpZylwCnBqBznZNkMg.jpg,"[18, 10749]",93934,5,"Je, tu, il, elle",A woman suffers a subdued psychological breakdown in the wake of a devastating breakup.,8.111,/4arnTs41WSLWsnENWdljFKo0pu1.jpg,1974-12-31,Je Tu Il Elle,False,6.424,86,86,0,0,10645.0,1974.0,3.5
False,/1aRa5HUQ4EyjBGQQdjb1Rt9BSYD.jpg,"[27, 878, 53]",1313469,2,STALKER,"Walking home from a date, Damian starts to feel as if someone or something is following him",1.939,/1l6E9pQ2usCohAbkuA0zyKdMzBU.jpg,2024-10-31,STALKER,False,0.0,0,0,0,0,205892.0,,
False,/v2lrrGksxcc0hDD2LP8RxKz712b.jpg,"[53, 80, 9648, 27]",16371,13,텔 미 썸딩,"Detective Cho, a cop on the edge, is mourning his mother's recent death while under investigation for graft; on top of that he is suddenly put in charge of a seemingly-impenetrable mystery.",7.251,/jRyGUU4WiK8EOQqeIUvhutITFlr.jpg,1999-11-13,Tell Me Something,False,6.2,56,118,0,68416,3184.0,,
False,/lpRPoEhIZn5unuuYdfuZuIEtfFd.jpg,"[878, 18, 10749]",415786,2,Mirror,"Layla, a writer and musician struggling with depression and trapped in a dying marriage, finds herself falling in love with a woman from a war torn dimension, with whom she can only communicate through her bathroom mirror.",0.456,/har8XAxo7FtKrt2tvN8KtGFr1em.jpg,2017-07-15,Mirror,False,9.0,1,29,1200,0,87723.0,1975.0,3.5
False,/g3hni0i9iAQ13jDGOFWavJFlojc.jpg,"[28, 12, 53]",341013,2,Atomic Blonde,An undercover MI6 agent is sent to Berlin during the Cold War to investigate the murder of a fellow agent and recover a missing list of double agents.,35.352,/vCmMRNbDlCno6ra91ruXp5rtsUC.jpg,2017-07-26,Atomic Blonde,False,6.4,6264,115,30000000,100014025,10146.0,2017.0,1.0
False,,[99],1265701,2,Rouge,"Rouge follows the current coach and four players, who shoulder the weight of the team’s celebrated history as well as the pressures of making future careers for themselves. Older legends tell tales of former victories while also exploring the challenging economic and environmental circumstances of the industrial town.",0.217,/6oaky3gOjBr42IEOgtIVW1pngSE.jpg,2024-04-28,Rouge,False,0.0,0,90,0,0,,1987.0,4.0
False,/mZj8EUr6F1x2PWZjKPxaeYd5WRw.jpg,"[12, 16, 35, 10751, 14]",11688,2,The Emperor's New Groove,"When self-centered Emperor Kuzco is turned into a llama by his scheming advisor, he is forced to rely on good-hearted peasant Pacha to get back home.",86.751,/xU635vn1lMD9DWDloeuKmuhxxnQ.jpg,2000-12-15,The Emperor's New Groove,False,7.6,6822,76,100000000,169327687,2.0,2000.0,2.0
False,/7TF4p86ZafnxFuNqWdhpHXFO244.jpg,"[18, 80]",769,2,GoodFellas,"The true story of Henry Hill, a half-Irish, half-Sicilian Brooklyn kid who is adopted by neighbourhood gangsters at an early age and climbs the ranks of a Mafia family under the guidance of Jimmy Conway.",75.447,/aKuFiU82s5ISJpGZp7YkIr3kCUd.jpg,1990-09-12,GoodFellas,False,8.5,13150,146,25000000,46800000,8880.0,1990.0,4.0
False,/zCjZfevPFBbOh2SAx2syIBHSqEI.jpg,"[28, 18, 878]",124905,2,Godzilla,"Ford Brody, a Navy bomb expert, has just reunited with his family in San Francisco when he is forced to go to Japan to help his estranged father, Joe. Soon, both men are swept up in an escalating crisis when an ancient alpha predator arises from the sea to combat malevolent adversaries that threaten the survival of humanity. The creatures leave colossal destruction in their wake, as they make their way toward their final battleground: San Francisco.",54.256,/tphkjmQq8WebuVwNXelmjLUXuPJ.jpg,2014-05-14,Godzilla,False,6.3,9223,123,160000000,524978362,923.0,1954.0,3.5
False,/2sxiysM6O0FAxeR2CEIeKSv9IkA.jpg,[35],814776,2,Bottoms,Unpopular best friends PJ and Josie start a high school self-defense club to meet girls and lose their virginity. They soon find themselves in over their heads when the most popular students start beating each other up in the name of self-defense.,17.792,/jeyTQrNEpyE1LZIgVlswYh3sc34.jpg,2023-08-25,Bottoms,False,6.7,654,91,11300000,12976079,12365.0,2023.0,3.0
False,/msYWUoIgekv7IrYtvMbrgwmPkKL.jpg,[99],989536,11,Peninsula,This documentary explores the tranquil history of Italian surfing along with the passion and dedication of the pioneers who shaped it.,1.231,/14HQB76qkJUKHu0MkXPre6sWS6k.jpg,2014-01-01,Peninsula,False,6.0,1,0,0,0,,2020.0,3.5
False,/iA8LoWS4Kf7zyAathOCb8Xs3ams.jpg,[18],44163,12,浮草物語,"An aging actor returns to a small town with his troupe and reunites with his former lover and illegitimate son, a scenario that enrages his current mistress and results in heartbreak for all.",4.969,/eR0KHE3mS2Ti8sOADMp9ZmKJdJG.jpg,1934-11-23,A Story of Floating Weeds,False,7.0,57,86,0,0,192.0,1934.0,3.5
False,/drA8fgR8xhqRNXATInYXL831OvE.jpg,[18],5156,11,Ladri di biciclette,"Unemployed Antonio is elated when he finally finds work hanging posters around war-torn Rome. However on his first day, his bicycle—essential to his work—gets stolen. His job is doomed unless he can find the thief. With the help of his son, Antonio combs the city, becoming desperate for justice.",16.167,/rLpveWO1hTNYF9LUZJZgTdq5nyf.jpg,1948-07-21,Bicycle Thieves,False,8.2,2454,90,133000,450159,1875.0,1948.0,2.0
False,/tKjyygDhMqqTCMPLp9XlIXswkuz.jpg,"[28, 18, 53, 80]",849869,13,길복순,"At work, she's a renowned assassin. At home, she's a single mom to a teenage daughter. Killing? That's easy. It's parenting that's the hard part.",16.977,/taYgn3RRpCGlTGdaGQvnSIOzXFy.jpg,2023-02-17,Kill Boksoon,False,6.822,441,137,0,0,126602.0,2023.0,4.0
False,/bfh9Z3Ghz4FOJAfLOAhmc3ccnHU.jpg,"[12, 14]",671,2,Harry Potter and the Philosopher's Stone,"Harry Potter has lived under the stairs at his aunt and uncle's house his whole life. But on his 11th birthday, he learns he's a powerful wizard—with a place waiting for him at the Hogwarts School of Witchcraft and Wizardry. As he learns to harness his newfound powers with the help of the school's kindly headmaster, Harry uncovers the truth about his parents' deaths—and about the villain who's to blame.",175.072,/wuMc08IPKEatf9rnMNXvIDxqP4W.jpg,2001-11-16,Harry Potter and the Philosopher's Stone,False,7.9,27949,152,125000000,976475550,174.0,2001.0,4.0
False,/aAQSJrzHWJa8Vj4aJcVPlj46333.jpg,"[18, 28]",25664,0,柔道龍虎榜,A former Judo champion is given the chance to redeem himself after he befriends a competitor and an aspiring singer.,8.631,/s1YNISzxpfbIx2noLvd3tEt7FWV.jpg,2004-07-08,Throw Down,False,6.8,104,95,0,0,5632.0,2004.0,4.5
False,/t6sTd4xrODKmAQiGUW3BWM60PzS.jpg,"[18, 27]",661791,3,La abuela,"Susana leaves her life in Paris, where she works as a model, and returns to Madrid to take care of her grandmother Pilar.",13.333,/ri3KIjGp3Ek6iKUsTzMigmxTvdw.jpg,2022-01-28,La Abuela (The Grandmother),False,5.863,452,101,3749231,1817696,29566.0,2021.0,1.0
False,/kszooR7v1TLFM4pzx6IkKq2jDAN.jpg,"[53, 9648, 80]",915935,5,Anatomie d'une chute,"A woman is suspected of her husband's murder, and their blind son faces a moral dilemma as the sole witness.",43.9,/kQs6keheMwCxJxrzV83VUwFtHkB.jpg,2023-08-23,Anatomy of a Fall,False,7.549,2681,151,6700000,35634133,58568.0,2023.0,3.5
False,/9sfVyE3sP2dkCwDyV7UlYP5TAAR.jpg,"[35, 18]",823754,2,Bo Burnham: Inside,"Stuck in COVID-19 lockdown, US comedian and musician Bo Burnham attempts to stay sane and happy by writing, shooting and performing a one-man comedy special.",8.437,/ku1UvTWYvhFQbSesOD6zteY7bXT.jpg,2021-07-22,Bo Burnham: Inside,False,8.0,515,87,0,0,,2021.0,1.0
False,/A7VwVYbtzTcsDUE6hRpXFkOFeJE.jpg,"[28, 80, 53]",11134,0,警察故事 III：超級警察,A Hong Kong detective teams up with his female Red Chinese counterpart to stop a Chinese drug czar.,24.192,/mUJOyCd4g0pNsU8thYI7UGrIpkl.jpg,1992-07-04,Police Story 3: Super Cop,False,6.9,507,96,900000,34391494,2521.0,,
False,/3N5QNUqS76GFYNoEayfkkJyAyTN.jpg,"[35, 12]",346698,2,Barbie,"Barbie and Ken are having the time of their lives in the colorful and seemingly perfect world of Barbie Land. However, when they get a chance to go to the real world, they soon discover the joys and perils of living among humans.",135.166,/iuFNMS8U5cb6xfzi51Dbkovj7vM.jpg,2023-07-19,Barbie,False,7.0,9609,114,145000000,1445638421,82968.0,2023.0,1.0
False,/ylBiGZhgBsly0frseG2PvqoYM4o.jpg,"[18, 10751]",49964,4,خانه‌ی دوست کجاست؟,"An 8 year old boy must return his friend's notebook he took by mistake, lest his friend be punished by expulsion from school.",11.213,/aU9WdjwfKTiBsiIh9Vgjr4onhnD.jpg,1987-07-01,Where Is The Friend's House?,False,7.9,368,83,0,0,11459.0,,
False,/npoUm3stzUM2lR46ClLDwBZDaeZ.jpg,"[18, 35]",262,2,The King of Comedy,"Aspiring comic Rupert Pupkin attempts to achieve success in show business by stalking his idol, a late night talk-show host who craves his own privacy.",16.745,/3BM78deUfeZfShqPTblZuamgC8a.jpg,1982-12-18,The King of Comedy,False,7.8,2346,109,19000000,2536000,10214.0,1982.0,4.5
False,/egK8OpGhJdoD3xzdiaQPiGEIyMw.jpg,"[35, 53, 80, 9648]",15196,2,Clue,"Clue finds six colorful dinner guests gathered at the mansion of their host, Mr. Boddy -- who turns up dead after his secret is exposed: He was blackmailing all of them. With the killer among them, the guests and Boddy's chatty butler must suss out the culprit before the body count rises.",22.831,/aRxbYOYHS8T73nzR8hsLousoplR.jpg,1985-12-13,Clue,False,7.22,1754,96,15000000,14643997,498.0,1985.0,1.0
False,/44SNTCSZTdbF5bzgUy4IfPV3DUq.jpg,[18],30020,4,طعم گيلاس,"A middle-aged Tehranian man, Mr. Badii is intent on killing himself and seeks someone to bury him after his demise. Driving around the city, the seemingly well-to-do Badii meets with numerous people, including a Muslim student, asking them to take on the job, but initially he has little luck. Eventually, Badii finds a man who is up for the task because he needs the money, but his new associate soon tries to talk him out of committing suicide.",17.169,/u6GYH4HyR0BVwpqFuTOc2g4KB1L.jpg,1997-09-28,Taste of Cherry,False,7.659,613,95,0,0,11459.0,1997.0,4.5
False,/4avmIRBBOs9b4DKoenf8SWWJJP7.jpg,"[53, 36, 18]",726759,2,Tetris,"In 1988, American video game salesman Henk Rogers discovers the video game Tetris. When he sets out to bring the game to the world, he enters a dangerous web of lies and corruption behind the Iron Curtain.",18.065,/4F2QwCOYHJJjecSvdOjStuVLkpu.jpg,2023-03-15,Tetris,False,7.686,1396,118,0,0,5374.0,2023.0,0.5
