adult,backdrop_path,genre_ids,id,original_language,original_title,overview,popularity,poster_path,release_date,title,video,vote_average,vote_count,runtime,budget,revenue,production_company_id,year,minhas_notas
False,/7xQk3HdCvkNmk3gblDGn9fVnbsT.jpg,"[12, 16, 35, 10751]",11619,2,Flushed Away,"London high-society mouse, Roddy is flushed down the toilet by Sid, a common sewer rat. Hang on for a madcap adventure deep in the sewer bowels of Ratropolis, where Roddy meets the resourceful Rita, the rodent-hating Toad and his faithful thugs, Spike and Whitey.",42.832,/o4JlinGGDwxfmtvyUotZQdDdLA2.jpg,2006-10-22,Flushed Away,False,6.3,3840,86,149000000,178120010,521.0,2006.0,2.5
False,/w1oD1MzHjnBJc5snKupIQaSBLIh.jpg,"[28, 12, 878]",559,2,Spider-Man 3,"The seemingly invincible Spider-Man goes up against an all-new crop of villains—including the shape-shifting Sandman. While Spider-Man’s superpowers are altered by an alien organism, his alter ego, Peter Parker, deals with nemesis Eddie Brock and also gets caught up in a love triangle.",71.733,/qFmwhVUoUSXjkKRmca5yGDEXBIj.jpg,2007-05-01,Spider-Man 3,False,6.4,14310,139,258000000,894983373,326.0,2007.0,1.0
False,/5VTFP2gYenwsRBW6ycn3eiZbudD.jpg,"[35, 10749]",3563,2,I Now Pronounce You Chuck & Larry,"Firefighters Chuck Ford and Larry Valentine are guy's guys, loyal to the core—which is why when widower Larry asks Chuck to pose as his lover so that he can get domestic partner benefits for his kids, his buddy agrees. However, things get dicey when a bureaucrat comes calling, and the boys are forced to present a picture of domestic bliss.",44.92,/6wjJ9EnNw4cmTSZYgnao7RpI3X.jpg,2007-07-12,I Now Pronounce You Chuck & Larry,False,6.1,2358,115,85000000,187134117,33.0,2007.0,1.5
False,/8ln5VUVk7gnNGIb2VNgw8nICDVt.jpg,"[16, 35, 10751]",35,2,The Simpsons Movie,"After Homer accidentally pollutes the town's water supply, Springfield is encased in a gigantic dome by the EPA and the Simpsons are declared fugitives.",61.452,/gzb6P78zeFTnv9eoFYnaJ2YrZ5q.jpg,2007-07-25,The Simpsons Movie,False,7.009,8079,87,75000000,527068851,18.0,2007.0,2.5
False,/dM69VHjYFs8JBFNwI1rG0c7xeQz.jpg,"[10751, 16, 12, 35]",5559,2,Bee Movie,"Barry B. Benson, a recent college graduate who wants more out of his life than making honey, decides to sue the human race after learning about the exploitation of bees at the hands of mankind.",38.046,/rYBaXgvTKFS8iZC7Wr8SMomSauQ.jpg,2007-10-28,Bee Movie,False,6.0,4905,90,150000000,287594577,1903.0,2007.0,1.0
False,/azheZwmLAiWZyDuL416NL0IxvFp.jpg,"[35, 878, 12, 10751]",11260,2,Meet Dave,"A crew of miniature aliens operate a spaceship that has a human form. While trying to save their planet, the aliens encounter a new problem, as their ship becomes smitten with an Earth woman.",17.5,/3Qfav5aVRcZmq854olMjJ795JJ2.jpg,2008-07-08,Meet Dave,False,5.279,1447,90,60000000,50650079,444.0,2008.0,0.5
False,/d0maxeUyreVK7vmBINwK1biU2Z5.jpg,"[28, 878, 12, 35, 10751]",88751,2,Journey to the Center of the Earth,"On a quest to find out what happened to his missing brother, a scientist, his nephew and their mountain guide discover a fantastic and dangerous lost world in the center of the earth.",35.028,/dGTtW6GUcs4FaLzGi9KBxpo8MWb.jpg,2008-07-10,Journey to the Center of the Earth,False,6.1,4854,93,45000000,101702060,12.0,2008.0,2.5
False,/iA5yYNAclwXWGe46T7gatzGYcRu.jpg,"[35, 28, 878]",11918,2,Superhero Movie,"Rick Riker is a nerdy teen imbued with superpowers by a radioactive dragonfly. And because every hero needs a nemesis, enter Lou Landers, aka the villainously goofy Hourglass.",24.082,/4MtvQdh5VP7jMSydhggp1P80FMj.jpg,2008-03-28,Superhero Movie,False,5.3,1847,82,35000000,71571300,7405.0,2008.0,2.0
False,/17QgDl7HRdUhloGt1zJwpUWg2a.jpg,"[27, 9648]",23827,2,Paranormal Activity,"After a young, middle-class couple moves into what seems like a typical suburban house, they become increasingly disturbed by a presence that may or may not be demonic but is certainly the most active in the middle of the night.",30.399,/tmclkEpjeo4Zu564gf3KrwIOuKw.jpg,2007-09-14,Paranormal Activity,False,6.01,5085,86,215000,193355800,3172.0,2007.0,0.5
False,/eQ74ZXqmcrNAVr5PEkQ9WHf9qVE.jpg,"[35, 10751]",13680,2,The Game Plan,"Bachelor football star Joe Kingman seems to have it all. He is wealthy and carefree, and his team is on the way to capturing a championship. Suddenly, he is tackled by some unexpected news: He has a young daughter, the result of a last fling with his ex-wife. Joe must learn to balance his personal and professional lives with the needs of his child.",27.877,/fcLFvIqCUrhY96mkSmr3okxaMEw.jpg,2007-09-28,The Game Plan,False,6.5,2070,110,22000000,147880543,80510.0,2007.0,1.5
False,/akcFhNdibYAsGUOfUhb5y1rFTet.jpg,"[16, 10751, 12, 878]",15512,2,Monsters vs Aliens,"When Susan Murphy is unwittingly clobbered by a meteor full of outer space gunk on her wedding day, she mysteriously grows to 49-feet-11-inches. The military jumps into action and captures Susan, secreting her away to a covert government compound. She is renamed Ginormica and placed in confinement with a ragtag group of Monsters...",51.591,/hpHarddVj34j53T7NsoUGdKj4mP.jpg,2009-03-19,Monsters vs Aliens,False,6.217,4674,102,175000000,381509870,521.0,2009.0,2.5
False,/oihWVx3imvRKujnGmSDYhfG1gI5.jpg,"[35, 27]",19908,2,Zombieland,"Columbus has made a habit of running from what scares him. Tallahassee doesn't have fears. If he did, he'd kick their ever-living ass. In a world overrun by zombies, these two are perfectly evolved survivors. But now, they're about to stare down the most terrifying prospect of all: each other.",41.9,/dUkAmAyPVqubSBNRjRqCgHggZcK.jpg,2009-10-02,Zombieland,False,7.26,12407,88,23600000,102391540,11733.0,2009.0,0.5
False,/qndvrOXGyoOxkhc12SqfLi9Hr31.jpg,"[14, 28]",8960,2,Hancock,"Hancock is a down-and-out superhero who's forced to employ a PR expert to help repair his image when the public grows weary of all the damage he's inflicted during his lifesaving heroics. The agent's idea of imprisoning the antihero to make the world miss him proves successful, but will Hancock stick to his new sense of purpose or slip back into old habits?",33.335,/7DyuV2G0hLEqHeueDfOqhZ2DVut.jpg,2008-07-01,Hancock,False,6.3,9678,92,150000000,629400000,5.0,2008.0,1.0
False,/1ZVlzOBYCggLzvVYHK7Im6LohjC.jpg,"[28, 12, 35, 10751, 14]",1593,2,Night at the Museum,"Chaos reigns at the natural history museum when night watchman Larry Daley accidentally stirs up an ancient curse, awakening Attila the Hun, an army of gladiators, a Tyrannosaurus rex and other exhibits.",35.321,/pDsAAYf6Zn0yiAGJ6lYGs6hoZ4E.jpg,2006-12-20,Night at the Museum,False,6.6,10325,108,110000000,574480841,436.0,2006.0,1.5
False,/85k0kaoRgGmF6ACq0M61AFxhjLN.jpg,"[35, 80]",12153,2,White Chicks,"Two FBI agent brothers, Marcus and Kevin Copeland, accidentally foil a drug bust. To avoid being fired they accept a mission escorting a pair of socialites to the Hamptons--but when the girls are disfigured in a car accident, they refuse to go. Left without options, Marcus and Kevin decide to pose as the sisters, transforming themselves from black men into rich white women.",81.32,/aHTUpo45qy9QYIOnVITGGqLoVcA.jpg,2004-06-23,White Chicks,False,6.9,4097,114,37000000,113100000,5.0,2004.0,2.5
False,/1nL5TJrldKI4rIj16tZTdqpdYL3.jpg,[35],9472,2,DodgeBall: A True Underdog Story,"When megalomaniacal White Goodman, the owner of a trendy, high-end fitness center, makes a move to take over the struggling local gym run by happy-go-lucky Pete La Fleur, there's only one way for La Fleur to fight back: dodgeball. Aided by a dodgeball guru and Goodman's attorney, La Fleur and his rag-tag team of underdogs launch a knock-down, drag-out battle in which the winner takes all.",22.822,/r8KbNHkkwFXLjV1suGwm0Qjure5.jpg,2004-06-18,DodgeBall: A True Underdog Story,False,6.354,3526,92,20000000,168423227,25.0,2004.0,1.0
False,/v23fWgJUEt8EMmvn19btIacxP8E.jpg,"[10749, 14, 16]",3933,2,Corpse Bride,"In a 19th-century European village, a young man about to be married is whisked away to the underworld and wed to a mysterious corpse bride, while his real bride waits bereft in the land of the living.",63.152,/isb2Qow76GpqYmsSyfdMfsYAjts.jpg,2005-09-12,Corpse Bride,False,7.58,9451,77,40000000,118133252,8601.0,2005.0,3.5
False,/tS3ByIQR6V61DaWhEIFbLSuLK5Q.jpg,"[12, 28, 53, 878]",44912,2,Green Lantern,"For centuries, a small but powerful force of warriors called the Green Lantern Corps has sworn to keep intergalactic order. Each Green Lantern wears a ring that grants him superpowers. But when a new enemy called Parallax threatens to destroy the balance of power in the Universe, their fate and the fate of Earth lie in the hands of the first human ever recruited.",30.686,/fj21HwUprqjjwTdkKC1XZurRSpV.jpg,2011-06-14,Green Lantern,False,5.171,7281,114,200000000,219851172,9993.0,2011.0,0.5
False,/2w4xG178RpB4MDAIfTkqAuSJzec.jpg,"[12, 28, 878]",11,2,Star Wars,Princess Leia is captured and held hostage by the evil Imperial forces in their effort to take over the galactic Empire. Venturesome Luke Skywalker and dashing captain Han Solo team together with the loveable robot duo R2-D2 and C-3PO to rescue the beautiful princess and restore peace and justice in the Empire.,107.66,/6FfCtAuVAW8XJjZ7eWeLibRLWTw.jpg,1977-05-25,Star Wars,False,8.203,20922,121,11000000,775398007,1.0,1977.0,3.0
False,/b37U5gN6itEjaFcmaKhUOqG2Mkt.jpg,"[12, 28, 878]",1891,2,The Empire Strikes Back,"The epic saga continues as Luke Skywalker, in hopes of defeating the evil Galactic Empire, learns the ways of the Jedi from aging master Yoda. But Darth Vader is more determined than ever to capture Luke. Meanwhile, rebel leader Princess Leia, cocky Han Solo, Chewbacca, and droids C-3PO and R2-D2 are thrown into various stages of capture, betrayal and despair.",43.669,/nNAeTmF4CtdSgMDplXTDPOpYzsX.jpg,1980-05-20,The Empire Strikes Back,False,8.4,17216,124,18000000,538400000,1.0,1980.0,3.0
False,/iP2tEA2A77qhbhRfcFkiD6WFOqH.jpg,"[12, 28, 878]",1892,2,Return of the Jedi,"Luke Skywalker leads a mission to rescue his friend Han Solo from the clutches of Jabba the Hutt, while the Emperor seeks to destroy the Rebellion once and for all with a second dreaded Death Star.",37.701,/jQYlydvHm3kUix1f8prMucrplhm.jpg,1983-05-25,Return of the Jedi,False,7.896,15894,135,32350000,572700000,1.0,1983.0,3.0
False,/fUoXenTsrdUcgG0sLYbOBouvtTs.jpg,"[12, 28, 878]",2080,2,X-Men Origins: Wolverine,"After seeking to live a normal life, Logan sets out to avenge the death of his girlfriend by undergoing the mutant Weapon X program and becoming Wolverine.",4.666,/yj8LbTju1p7CUJg7US2unSBk33s.jpg,2009-04-28,X-Men Origins: Wolverine,False,6.273,10621,108,150000000,373062864,431.0,2009.0,2.0
False,/7D2PgX369YYePs4m44IQvROWM42.jpg,"[28, 878, 12]",76170,2,The Wolverine,"Wolverine faces his ultimate nemesis - and tests of his physical, emotional, and mortal limits - in a life-changing voyage to modern-day Japan.",6.387,/8lzmovtARDXnE7kTDOum02i6fXv.jpg,2013-07-21,The Wolverine,False,6.419,9714,126,120000000,415440673,431.0,2013.0,2.0
False,/8asUJMTcr1KEfbGtpZhESI0I7X6.jpg,"[28, 80, 18]",20174,2,The Fast and the Furious,"A framed man escapes prison and takes a wealthy woman's Jaguar with her in it. After she tries to escape numerous times, they begin to develop feelings for each other, and enter a road race that ends in Mexico.",5.322,/731NMB4a85McIYcftPtbH4D3l5x.jpg,1954-11-01,The Fast and the Furious,False,4.9,32,76,50000,250000,3733.0,2001.0,2.0
False,/o4mQHoP8LExn2Q9dn16OGqHvaiK.jpg,"[12, 18, 10751]",1265,2,Bridge to Terabithia,"Jesse Aarons trained all summer to become the fastest runner in school. So he's very upset when newcomer Leslie Burke outruns him and everyone else. Despite this and other differences including that she's rich, he's poor, she's a city girl, and he's a country boy the two become fast friends. Together they create Terabithia, a land of monsters, trolls, ogres, and giants where they rule as king and queen.",50.125,/3xFxGodKPMFLheS8rujFSmLfcq4.jpg,2007-02-15,Bridge to Terabithia,False,7.3,4856,96,60000000,137587063,60611.0,2007.0,3.5
False,/fatz1aegtBGh7KS0gipcsw9MqUn.jpg,"[18, 36]",583406,2,Judas and the Black Messiah,Bill O'Neal infiltrates the Black Panthers on the orders of FBI Agent Mitchell and J. Edgar Hoover. As Black Panther Chairman Fred Hampton ascends—falling for a fellow revolutionary en route—a battle wages for O’Neal’s soul.,15.534,/iIgr75GoqFxe1X5Wz9siOODGe9u.jpg,2021-02-12,Judas and the Black Messiah,False,7.319,1554,126,26000000,6416063,79426.0,2021.0,3.0
False,/aJn9XeesqsrSLKcHfHP4u5985hn.jpg,"[878, 12, 28]",283995,2,Guardians of the Galaxy Vol. 2,The Guardians must fight to keep their newfound family together as they unravel the mysteries of Peter Quill's true parentage.,67.755,/y4MBh0EjBlMuOzv9axM4qJlmhzz.jpg,2017-04-19,Guardians of the Galaxy Vol. 2,False,7.6,21793,136,200000000,863756051,420.0,2017.0,3.0
False,/uLtVbjvS1O7gXL8lUOwsFOH4man.jpg,"[28, 878, 12]",118340,2,Guardians of the Galaxy,"Light years from Earth, 26 years after being abducted, Peter Quill finds himself the prime target of a manhunt after discovering an orb wanted by Ronan the Accuser.",46.748,/jPrJPZKJVhvyJ4DmUTrDgmFN0yG.jpg,2014-07-30,Guardians of the Galaxy,False,7.905,28308,121,170000000,772776600,420.0,2014.0,3.0
False,/cyecB7godJ6kNHGONFjUyVN9OX5.jpg,"[28, 878, 12]",1726,2,Iron Man,"After being held captive in an Afghan cave, billionaire engineer Tony Stark creates a unique weaponized suit of armor to fight evil.",96.958,/78lPtwv72eTNqFW9COBYI0dWDJa.jpg,2008-04-30,Iron Man,False,7.647,26692,126,140000000,585174222,420.0,2008.0,2.5
False,/cMUReq46MSz6WWsdW1Gu8oecJlc.jpg,[18],10637,2,Remember the Titans,"After leading his football team to 15 winning seasons, coach Bill Yoast is demoted and replaced by Herman Boone – tough, opinionated and as different from the beloved Yoast as he could be. The two men learn to overcome their differences and turn a group of hostile young men into champions.",31.888,/825ohvC4wZ3gCuncCaqkWeQnK8h.jpg,2000-09-29,Remember the Titans,False,7.6,2708,113,30000000,136700000,130.0,2000.0,3.0
False,/1uQSh7P3k0oRbRf0vH8GVt4thpP.jpg,"[12, 28, 878]",1894,2,Star Wars: Episode II - Attack of the Clones,"Following an assassination attempt on Senator Padmé Amidala, Jedi Knights Anakin Skywalker and Obi-Wan Kenobi investigate a mysterious plot that could change the galaxy forever.",34.573,/oZNPzxqM2s5DyVWab09NTQScDQt.jpg,2002-05-15,Star Wars: Episode II - Attack of the Clones,False,6.571,13420,142,120000000,649398328,1.0,,
False,/hPO0A0BGg5M7Q8I7qayaDyC5tb5.jpg,"[12, 28, 878]",1895,2,Star Wars: Episode III - Revenge of the Sith,The evil Darth Sidious enacts his final plan for unlimited power -- and the heroic Jedi Anakin Skywalker must choose a side.,47.693,/xfSAoBEm9MNBjmlNcDYLvLSMlnq.jpg,2005-05-17,Star Wars: Episode III - Revenge of the Sith,False,7.4,13923,140,113000000,850000000,1.0,,
False,/5fu7fzy4NZTsL1Jap00UBIInAuB.jpg,"[12, 28, 878]",1893,2,Star Wars: Episode I - The Phantom Menace,"Anakin Skywalker, a young slave strong with the Force, is discovered on Tatooine. Meanwhile, the evil Sith have returned, enacting their plot for revenge against the Jedi.",46.499,/6wkfovpn7Eq8dYNKaG5PY3q2oq6.jpg,1999-05-19,Star Wars: Episode I - The Phantom Menace,False,6.6,14821,136,115000000,924317558,1.0,,
False,/zbGteYxh9dMJAKPyZY9AWzzHR5I.jpg,"[14, 35, 10751, 12]",10214,2,Son of the Mask,"Tim Avery, an aspiring cartoonist, finds himself in a predicament when his dog stumbles upon the mask of Loki. Then after conceiving an infant son ""born of the mask"", he discovers just how looney child raising can be.",30.039,/Adgnfhm9B8YAQmC0osuP4zO9SRc.jpg,2005-02-11,Son of the Mask,False,4.2,1845,94,84000000,59918422,12.0,2005.0,1.0
False,/zyWbOvKCdA9V9P5xuUG2eiPYsUo.jpg,"[12, 14, 10751]",10601,2,Peter Pan,"In stifling Edwardian London, Wendy Darling mesmerizes her brothers every night with bedtime tales of swordplay, swashbuckling and the fearsome Captain Hook. But the children become the heroes of an even greater story, when Peter Pan flies into their nursery one night and leads them over moonlit rooftops through a galaxy of stars and to the lush jungles of Neverland.",32.095,/6QdU3TZZrIvXFzoHOwafZAynFjB.jpg,2003-12-18,Peter Pan,False,7.2,2641,115,100000000,121975011,33.0,2003.0,3.0
False,/324Ztjb22pdtxI8NW7mjGknL4CE.jpg,"[35, 10751]",10708,2,Daddy Day Care,"Two men get laid off and have to become stay-at-home dads when they can't find jobs, which inspires them to open their own day-care center.",19.398,/uiey5XUKuPicwpIJMf1OpaOd1jL.jpg,2003-05-09,Daddy Day Care,False,5.9,2132,92,60000000,164433867,497.0,2003.0,2.0
False,/mFt3dvxKugYPgUQgV16M6K2nEtc.jpg,[35],8363,2,Superbad,Two co-dependent high school seniors are forced to deal with separation anxiety after their plan to stage a booze-soaked party goes awry.,51.901,/ek8e8txUyUwd2BNqj6lFEerJfbq.jpg,2007-03-20,Superbad,False,7.3,7439,113,20000000,170800000,5.0,2007.0,2.0
False,/iX7Gc2eidasIIZLnX4tLMSKUVUS.jpg,"[35, 18, 14]",9339,2,Click,"A married workaholic, Michael Newman doesn't have time for his wife and children, not if he's to impress his ungrateful boss and earn a well-deserved promotion. So when he meets Morty, a loopy sales clerk, he gets the answer to his prayers: a magical remote that allows him to bypass life's little distractions with increasingly hysterical results.",33.883,/oL0k5JA53PyoHSZqKb3cNkhwBCE.jpg,2006-06-23,Click,False,6.292,7100,107,82500000,240685326,333.0,2006.0,2.0
False,/7hga0cArQuBqBCgt7L1LSNOcGek.jpg,"[35, 12, 14]",9760,2,Epic Movie,"When the Pevensie siblings each follow their own path, they find themselves at Willy's Chocolate Factory. Walking through a wardrobe, they discover the world of Gnarnia, ruled by the White Bitch. Meeting up with characters such as Harry Potter and Captain Jack Swallows, the newly reunited family must team up with Aslo, a wise-but-horny lion to stop the White Bitch's army.",24.65,/l0lGJiTzU2Ce6T31DIRWv7I0kaC.jpg,2007-01-25,Epic Movie,False,3.9,1552,86,20000000,87238158,508.0,2007.0,1.0
False,/nMgQD51KzAqrt4F6iwxw5TetVLW.jpg,[35],9757,2,Norbit,"A mild-mannered guy who is engaged to a monstrous woman meets the woman of his dreams, and schemes to find a way to be with her.",50.868,/XcZ5NzygPp54csxCnzvQKuxFL2.jpg,2007-02-08,Norbit,False,5.7,2417,102,10000000,159814490,2184.0,2007.0,1.5
False,/oSU1pEm2V6Ikj4N5pP6gO1nYNJe.jpg,"[35, 14]",72105,2,Ted,"John Bennett, a man whose childhood wish of bringing his teddy bear to life came true, now must decide between keeping the relationship with the bear or his girlfriend, Lori.",53.96,/1QVZXQQHCEIj8lyUhdBYd2qOYtq.jpg,2012-06-29,Ted,False,6.438,12446,107,50000000,549368315,33.0,2012.0,0.5
False,/aGmsekNU5cMOkJMpbdRutkvmVMl.jpg,[35],45243,2,The Hangover Part II,"The Hangover crew heads to Thailand for Stu's wedding. After the disaster of a bachelor party in Las Vegas last year, Stu is playing it safe with a mellow pre-wedding brunch. However, nothing goes as planned and Bangkok is the perfect setting for another adventure with the rowdy group.",77.25,/7sGkjqorTHkaHTz8Q4WWHj8JL9t.jpg,2011-05-25,The Hangover Part II,False,6.5,10603,101,80000000,586764305,923.0,2011.0,0.5
False,/ubiu5Y7nP187ZFWUzjPj7Hgw6Go.jpg,[35],18785,2,The Hangover,"When three friends finally come to after a raucous night of bachelor-party revelry, they find a baby in the closet and a tiger in the bathroom. But they can't seem to locate their best friend, Doug – who's supposed to be tying the knot. Launching a frantic search for Doug, the trio perseveres through a nasty hangover to try to make it to the church on time.",104.155,/A0uS9rHR56FeBtpjVki16M5xxSW.jpg,2009-06-02,The Hangover,False,7.322,17085,99,35000000,469310836,923.0,2009.0,1.5
False,/w7TUrUUo9pKcgY7PCdm2LK6XbZB.jpg,"[28, 35, 10751]",23172,2,The Spy Next Door,"Former CIA spy Bob Ho takes on his toughest assignment to date: looking after his girlfriend's three kids, who haven't exactly warmed to their mom's beau. And when one of the youngsters accidentally downloads a top-secret formula, Bob's longtime nemesis, a Russian terrorist, pays a visit to the family.",20.486,/nJJrceb2xHGIA0irADX0JvWSIHT.jpg,2010-01-15,The Spy Next Door,False,5.9,1311,94,28000000,66166000,46062.0,2010.0,2.0
False,/veXdzn7LL0bFIDGmE7tTkvRg0qV.jpg,"[28, 12, 80, 9648]",10528,2,Sherlock Holmes,Eccentric consulting detective Sherlock Holmes and Doctor John Watson battle to bring down a new nemesis and unravel a deadly plot that could destroy England.,51.807,/fvnu6QHyR0gSV1JI6lMyXCny21a.jpg,2009-12-23,Sherlock Holmes,False,7.214,14053,129,90000000,524028679,174.0,2009.0,2.5
False,/cWczNud8Y8i8ab0Z4bxos4myWYO.jpg,"[16, 10751, 12]",38757,2,Tangled,"Feisty teenager Rapunzel, who has long and magical hair, wants to go and see sky lanterns on her eighteenth birthday, but she's bound to a tower by her overprotective mother. She strikes a deal with Flynn Rider, a charming wanted thief, and the duo set off on an action-packed escapade.",99.516,/ym7Kst6a4uodryxqbGOxmewF235.jpg,2010-11-24,Tangled,False,7.6,11638,101,260000000,592461732,6125.0,2010.0,2.0
False,/iv1ajZACUGHn4JztG9Z8yvbcmic.jpg,"[35, 10402]",1584,2,School of Rock,"Fired from his band and hard up for cash, guitarist and vocalist Dewey Finn finagles his way into a job as a fifth-grade substitute teacher at a private school, where he secretly begins teaching his students the finer points of rock 'n' roll. The school's hard-nosed principal is rightly suspicious of Finn's activities. But Finn's roommate remains in the dark about what he's doing.",31.967,/zXLXaepIBvFVLU25DH3wv4IPSbe.jpg,2003-10-03,School of Rock,False,7.082,5712,108,35000000,131100000,4.0,2003.0,3.0
False,/7b5R8FfGUzlxfhOkPpL3xyIeuyF.jpg,"[18, 10402]",502033,2,Sound of Metal,"Metal drummer Ruben begins to lose his hearing. When a doctor tells him his condition will worsen, he thinks his career and life is over. His girlfriend Lou checks the former addict into a rehab for the deaf hoping it will prevent a relapse and help him adapt to his new life. After being welcomed and accepted just as he is, Ruben must choose between his new normal and the life he once knew.",15.693,/3178oOJKKPDeQ2legWQvMPpllv.jpg,2020-11-20,Sound of Metal,False,7.718,2578,121,0,516520,178367.0,2019.0,2.5
False,/81TAV2k2HCjYblHZfDJ7OWeLEFP.jpg,"[10402, 35, 18]",95179,13,Mr. 아이돌,"It's hard being a Korean popstar! For every Gangnam Style, there are a hundred flameouts. K-Pop sensation Jay Park stars in this musical romp about a sassy music executive on her quest to resurrect a disgraced boy band against all odds.",2.043,/aAW1j1uMvhfU1W6n3PEblA4WX07.jpg,2011-11-03,Mr. Idol,False,4.8,9,113,0,0,140907.0,,
False,/fVpFOcQyHJM2di9upgSIwWD5wac.jpg,"[27, 53, 28, 12]",396535,13,부산행,"When a zombie virus pushes Korea into a state of emergency, those trapped on an express train to Busan must fight for their own survival.",113.172,/vNVFt6dtcqnI7hqa6LFBUibuFiw.jpg,2016-07-20,Train to Busan,False,7.8,7645,118,8500000,87547518,20064.0,2016.0,2.5
False,/rvtdN5XkWAfGX6xDuPL6yYS2seK.jpg,"[80, 9648, 53]",414906,2,The Batman,"In his second year of fighting crime, Batman uncovers corruption in Gotham City that connects to his own family while facing a serial killer known as the Riddler.",99.804,/74xTEgt7R36Fpooo50r9T25onhq.jpg,2022-03-01,The Batman,False,7.7,10677,185,185000000,772319315,101405.0,2022.0,1.5
False,/vuglA60RqvpHK9rIcG8sXaiWw1L.jpg,"[18, 35, 10749]",11104,0,重慶森林,"Two melancholic Hong Kong policemen fall in love: one with a mysterious underworld figure, the other with a beautiful and ethereal server at a late-night restaurant.",40.201,/43I9DcNoCzpyzK8JCkJYpHqHqGG.jpg,1994-07-14,Chungking Express,False,7.968,1872,103,160000,0,540.0,1994.0,3.5
False,/o30k6ehjyiNwFoHeytZH9Gcdo64.jpg,[18],108949,22,Insiang,"A story about the life of a young girl living with her mother in the slums of Manila, which becomes unbearable when her mother's young boyfriend moves in with them.",4.835,/7wJGOAQGleC7mWJRRN1aCym0oM8.jpg,1976-12-25,Insiang,False,7.1,59,94,0,0,69395.0,1976.0,2.5
False,/k6ANeyxAfMRi5xhxIXv1Scn9vc2.jpg,"[27, 80, 53]",934433,2,Scream VI,"Following the latest Ghostface killings, the four survivors leave Woodsboro behind and start a fresh chapter.",59.379,/wDWwtvkRRlgTiUr6TyLSMX8FCuZ.jpg,2023-03-08,Scream VI,False,7.004,2728,122,35000000,168961389,126588.0,2023.0,1.5
False,/xgic8uEqzzhc0YimHGsWSQWMduE.jpg,"[16, 10751, 14, 28, 12, 35, 878]",19585,2,G-Force,"A team of trained secret agent animals, guinea pigs Darwin, Hurley, Juarez, Blaster, mole Speckles, and fly Mooch takes on a mission for the US government to stop evil Leonard Saber, who plans to destroy the world with household appliances. But the government shuts them down and they are sentenced to a pet shop. Can they escape to defeat the villain and save the world?",15.763,/fkqcF21HKZPvCwO6BHPa3aCRaxz.jpg,2009-07-24,G-Force,False,5.5,1886,88,150000000,292817841,2.0,2009.0,1.5
False,/nawzkUvXFv5J0Lwjw1OLwZGXLSA.jpg,"[35, 14]",40264,2,Vampires Suck,"Becca, an anxious, non-vampire teen is torn between two boys. Before she can choose, Becca must get around her controlling father, who treats her like a child. Meanwhile, Becca's friends contend with their own romantic issues – all of which collide at the prom.",19.248,/ksPKfoXovAiFnBktkCBefsRQ8a1.jpg,2010-08-18,Vampires Suck,False,4.3,1300,82,20000000,80547866,2648.0,2010.0,0.5
False,/8ZTVqvKDQ8emSGUEMjsS4yHAwrp.jpg,"[28, 878, 12]",27205,2,Inception,"Cobb, a skilled thief who commits corporate espionage by infiltrating the subconscious of his targets is offered a chance to regain his old life as payment for a task considered to be impossible: ""inception"", the implantation of another person's idea into a target's subconscious.",162.438,/ljsZTbVsrQSqZgWeep2B1QiDKuh.jpg,2010-07-15,Inception,False,8.4,37121,148,160000000,839030630,923.0,2010.0,3.0
